{
  "$schema": "http://json-schema.org/draft-07/schema#",
  "type": "array",
  "items": {
    "type": "object",
    "required": ["id", "name", "hometown", "role"],
    "properties": {
      "id": { "type": "string", "pattern": "^[a-z0-9-]+$" },
      "name": { "type": "string", "minLength": 1 },
      "position": { "enum": ["F", "D", "G"] },
      "number": { "type": "integer", "minimum": 1, "maximum": 99 },
      "hometown": { "type": "string" },
      "role": { "enum": ["player", "head-coach", "assistant-coach", "trainer", "assistant-trainer", "equipment-manager", "president", "owner", "staff"] },
      "notes": { "type": "string" },
      "bio": { "type": "string" },
      "programBio": {
        "type": "string",
        "description": "Verbatim/lightly-edited mini-bio from the 1986-87 Abbott Cup or Centennial Cup Souvenir Program. Primary source snapshot of who the player was in 1987."
      },
      "aliases": {
        "type": "array",
        "description": "Nicknames and clubhouse aliases from primary sources.",
        "items": { "type": "string" }
      },
      "priorTeams": {
        "type": "array",
        "description": "Teams the player played for before joining the Sockeyes (minor/junior/university), in chronological order where known.",
        "items": { "type": "string" }
      },
      "linemates": {
        "type": "array",
        "description": "Roster ids of regular 1986-87 linemates, per the souvenir program.",
        "items": { "type": "string", "pattern": "^[a-z0-9-]+$" }
      },
      "scoutingNotes": {
        "type": "string",
        "description": "Brief scouting / narrative assessment of the player in 1986-87 (from program or contemporaneous press)."
      },
      "personalDetails": {
        "type": "object",
        "description": "Personality, hobbies, and off-ice notes from the 1987 program.",
        "properties": {
          "hobbies":  { "type": "array", "items": { "type": "string" } },
          "likes":    { "type": "array", "items": { "type": "string" } },
          "dislikes": { "type": "array", "items": { "type": "string" } },
          "college":  { "type": "string" }
        },
        "additionalProperties": false
      },
      "photoUrl": { "type": "string" },
      "birthDate": { "type": "string", "pattern": "^[0-9]{4}-[0-9]{2}-[0-9]{2}$" },
      "height": { "type": "string" },
      "weight": { "type": "integer", "minimum": 0 },
      "shoots": { "enum": ["L", "R"] },
      "awards": { "type": "array", "items": { "type": "string" } },
      "links": {
        "type": "object",
        "properties": {
          "hockeydb":       { "type": "string", "format": "uri" },
          "eliteprospects": { "type": "string", "format": "uri" },
          "wikipedia":      { "type": "string", "format": "uri" },
          "other": {
            "type": "array",
            "items": {
              "type": "object",
              "required": ["label", "url"],
              "properties": {
                "label": { "type": "string" },
                "url":   { "type": "string", "format": "uri" }
              },
              "additionalProperties": false
            }
          }
        },
        "additionalProperties": false
      },
      "careerStats": {
        "type": "array",
        "items": {
          "type": "object",
          "required": ["season", "team", "league", "type", "stats"],
          "properties": {
            "season": { "type": "string", "pattern": "^[0-9]{4}-[0-9]{2}$" },
            "team":   { "type": "string" },
            "league": { "type": "string" },
            "type":   { "enum": ["regular", "playoff"] },
            "stats": {
              "oneOf": [
                { "type": "object", "required": ["gp","g","a","pts","pim"],
                  "properties": {
                    "gp":  { "type": "integer", "minimum": 0 },
                    "g":   { "type": "integer", "minimum": 0 },
                    "a":   { "type": "integer", "minimum": 0 },
                    "pts": { "type": "integer", "minimum": 0 },
                    "pim": { "type": "integer", "minimum": 0 }
                  }, "additionalProperties": false },
                { "type": "object", "required": ["gp","w","l","gaa","svpct","so"],
                  "properties": {
                    "gp":    { "type": "integer", "minimum": 0 },
                    "w":     { "type": "integer", "minimum": 0 },
                    "l":     { "type": "integer", "minimum": 0 },
                    "gaa":   { "type": "number",  "minimum": 0 },
                    "svpct": { "type": "number",  "minimum": 0, "maximum": 1 },
                    "so":    { "type": "integer", "minimum": 0 }
                  }, "additionalProperties": false }
              ]
            }
          },
          "additionalProperties": false
        }
      },
      "playoffStats": {
        "oneOf": [
          { "type": "object", "required": ["gp","g","a","pts","pim"],
            "properties": {
              "gp": {"type":"integer","minimum":0}, "g":{"type":"integer","minimum":0},
              "a":  {"type":"integer","minimum":0}, "pts":{"type":"integer","minimum":0},
              "pim":{"type":"integer","minimum":0}
            }, "additionalProperties": false },
          { "type": "object", "required": ["gp","w","l","gaa","svpct","so"],
            "properties": {
              "gp":{"type":"integer","minimum":0}, "w":{"type":"integer","minimum":0},
              "l":{"type":"integer","minimum":0}, "gaa":{"type":"number","minimum":0},
              "svpct":{"type":"number","minimum":0,"maximum":1}, "so":{"type":"integer","minimum":0}
            }, "additionalProperties": false }
        ]
      },
      "postseasonStats": {
        "oneOf": [
          { "type": "object", "required": ["gp","g","a","pts","pim"],
            "properties": {
              "gp": {"type":"integer","minimum":0}, "g":{"type":"integer","minimum":0},
              "a":  {"type":"integer","minimum":0}, "pts":{"type":"integer","minimum":0},
              "pim":{"type":"integer","minimum":0}
            }, "additionalProperties": false },
          { "type": "object", "required": ["gp","w","l","gaa","svpct","so"],
            "properties": {
              "gp":{"type":"integer","minimum":0}, "w":{"type":"integer","minimum":0},
              "l":{"type":"integer","minimum":0}, "gaa":{"type":"number","minimum":0},
              "svpct":{"type":"number","minimum":0,"maximum":1}, "so":{"type":"integer","minimum":0}
            }, "additionalProperties": false }
        ]
      },
      "abbottCupStats": {
        "description": "Official playoff totals through the Abbott Cup (Mowat + Doyle + Abbott runs, 15 games) per 1987 Abbott Cup Souvenir Program. Excludes Centennial Cup.",
        "oneOf": [
          { "type": "object", "required": ["gp","g","a","pts","pim"],
            "properties": {
              "gp": {"type":"integer","minimum":0}, "g":{"type":"integer","minimum":0},
              "a":  {"type":"integer","minimum":0}, "pts":{"type":"integer","minimum":0},
              "pim":{"type":"integer","minimum":0}
            }, "additionalProperties": false },
          { "type": "object", "required": ["gp"],
            "properties": {
              "gp":{"type":"integer","minimum":0}, "w":{"type":"integer","minimum":0},
              "l":{"type":"integer","minimum":0}, "gaa":{"type":"number","minimum":0},
              "svpct":{"type":"number","minimum":0,"maximum":1}, "so":{"type":"integer","minimum":0}
            }, "additionalProperties": false }
        ]
      },
      "doyleCupStats": {
        "description": "Verified 7-game Doyle Cup final totals (Richmond vs Red Deer Rustlers, Apr 7-16 1987). Derived from Red Deer Advocate box scores plus cross-referenced CP wire copy. Partial where box scores were unavailable.",
        "oneOf": [
          { "type": "object", "required": ["gp","g","a","pts","pim"],
            "properties": {
              "gp": {"type":"integer","minimum":0}, "g":{"type":"integer","minimum":0},
              "a":  {"type":"integer","minimum":0}, "pts":{"type":"integer","minimum":0},
              "pim":{"type":"integer","minimum":0}
            }, "additionalProperties": false },
          { "type": "object", "required": ["gp"],
            "properties": {
              "gp":{"type":"integer","minimum":0}, "w":{"type":"integer","minimum":0},
              "l":{"type":"integer","minimum":0}, "gaa":{"type":"number","minimum":0},
              "svpct":{"type":"number","minimum":0,"maximum":1}, "so":{"type":"integer","minimum":0}
            }, "additionalProperties": false }
        ]
      },
      "abbottCupSeriesStats": {
        "description": "Verified 7-game Abbott Cup final totals (Richmond vs Humboldt Broncos, Apr 20-29 1987). Distinct from abbottCupStats, which is tournament-wide through the Abbott Cup (15 games) per the 1987 program.",
        "oneOf": [
          { "type": "object", "required": ["gp","g","a","pts","pim"],
            "properties": {
              "gp": {"type":"integer","minimum":0}, "g":{"type":"integer","minimum":0},
              "a":  {"type":"integer","minimum":0}, "pts":{"type":"integer","minimum":0},
              "pim":{"type":"integer","minimum":0}
            }, "additionalProperties": false },
          { "type": "object", "required": ["gp"],
            "properties": {
              "gp":{"type":"integer","minimum":0}, "w":{"type":"integer","minimum":0},
              "l":{"type":"integer","minimum":0}, "gaa":{"type":"number","minimum":0},
              "svpct":{"type":"number","minimum":0,"maximum":1}, "so":{"type":"integer","minimum":0}
            }, "additionalProperties": false }
        ]
      },
      "centennialCupStats": {
        "description": "Verified 5-game Centennial Cup tournament totals (Humboldt Uniplex, May 3-9 1987): 3 round-robin + 1 semifinal + 1 final. Assists and PIM are partial — only the Pembroke round-robin and Humboldt final had full period-by-period boxes printed; other games had narrative-only scorer lists.",
        "oneOf": [
          { "type": "object", "required": ["gp","g","a","pts","pim"],
            "properties": {
              "gp": {"type":"integer","minimum":0}, "g":{"type":"integer","minimum":0},
              "a":  {"type":"integer","minimum":0}, "pts":{"type":"integer","minimum":0},
              "pim":{"type":"integer","minimum":0}
            }, "additionalProperties": false },
          { "type": "object", "required": ["gp"],
            "properties": {
              "gp":{"type":"integer","minimum":0}, "w":{"type":"integer","minimum":0},
              "l":{"type":"integer","minimum":0}, "gaa":{"type":"number","minimum":0},
              "svpct":{"type":"number","minimum":0,"maximum":1}, "so":{"type":"integer","minimum":0}
            }, "additionalProperties": false }
        ]
      }
    },
    "additionalProperties": false
  }
}
