[
  {
    "id": "rob-sumner",
    "name": "Rob Sumner",
    "position": "F",
    "number": 2,
    "hometown": "",
    "role": "player",
    "playoffStats": { "gp": 44, "g": 1, "a": 18, "pts": 19, "pim": 103 },
    "bio": "Rob Sumner broke into junior hockey with the 1986-87 Richmond Sockeyes, posting 19 points and 103 penalty minutes in 44 games as the team captured the Centennial Cup. He moved on to a three-season stint with the WHL's Victoria Cougars, followed by a brief stop with the Prince Albert Raiders. Sumner later turned professional in the ECHL, playing for the Louisville Icehawks and South Carolina Stingrays between 1992 and 1995.",
    "awards": [
      "Centennial Cup Champion 1987",
      "Abbott Cup Champion 1987",
      "Doyle Cup Champion 1987",
      "Mowat Cup Champion 1987",
      "BC Hockey Hall of Fame Inductee 2025"
    ],
    "links": {
      "hockeydb": "https://www.hockeydb.com/ihdb/stats/pdisplay.php?pid=7024"
    },
    "careerStats": [
      { "season": "1986-87", "team": "Richmond Sockeyes", "league": "BCJHL", "type": "regular", "stats": { "gp": 44, "g": 1, "a": 18, "pts": 19, "pim": 103 } },
      { "season": "1987-88", "team": "Victoria Cougars", "league": "WHL", "type": "regular", "stats": { "gp": 68, "g": 0, "a": 6, "pts": 6, "pim": 134 } },
      { "season": "1987-88", "team": "Victoria Cougars", "league": "WHL", "type": "playoff", "stats": { "gp": 8, "g": 0, "a": 1, "pts": 1, "pim": 18 } },
      { "season": "1988-89", "team": "Victoria Cougars", "league": "WHL", "type": "regular", "stats": { "gp": 66, "g": 2, "a": 15, "pts": 17, "pim": 228 } },
      { "season": "1988-89", "team": "Victoria Cougars", "league": "WHL", "type": "playoff", "stats": { "gp": 8, "g": 0, "a": 1, "pts": 1, "pim": 24 } },
      { "season": "1989-90", "team": "Victoria Cougars", "league": "WHL", "type": "regular", "stats": { "gp": 58, "g": 2, "a": 19, "pts": 21, "pim": 206 } },
      { "season": "1990-91", "team": "Prince Albert Raiders", "league": "WHL", "type": "regular", "stats": { "gp": 22, "g": 0, "a": 5, "pts": 5, "pim": 64 } },
      { "season": "1990-91", "team": "Prince Albert Raiders", "league": "WHL", "type": "playoff", "stats": { "gp": 3, "g": 0, "a": 0, "pts": 0, "pim": 4 } },
      { "season": "1992-93", "team": "Louisville Icehawks", "league": "ECHL", "type": "regular", "stats": { "gp": 64, "g": 1, "a": 20, "pts": 21, "pim": 180 } },
      { "season": "1993-94", "team": "Louisville Icehawks", "league": "ECHL", "type": "regular", "stats": { "gp": 68, "g": 4, "a": 21, "pts": 25, "pim": 229 } },
      { "season": "1993-94", "team": "Louisville Icehawks", "league": "ECHL", "type": "playoff", "stats": { "gp": 6, "g": 0, "a": 2, "pts": 2, "pim": 33 } },
      { "season": "1994-95", "team": "South Carolina Stingrays", "league": "ECHL", "type": "regular", "stats": { "gp": 35, "g": 1, "a": 9, "pts": 10, "pim": 114 } }
    ]
  },
  {
    "id": "mike-claringbull",
    "name": "Mike Claringbull",
    "position": "D",
    "number": 3,
    "hometown": "Pincher Creek, AB",
    "role": "player",
    "playoffStats": { "gp": 11, "g": 2, "a": 5, "pts": 7, "pim": 24 },
    "bio": "Mike Claringbull was born November 29, 1966 in Pincher Creek, Alberta. He played junior A in the Alberta Junior Hockey League with the Hobbema Hawks before two WHL seasons with the Medicine Hat Tigers, where he was drafted by the Montreal Canadiens in 1985. He joined the Richmond Sockeyes for the 1986-87 championship run, contributing on the blue line through the playoff drive.",
    "awards": [
      "Centennial Cup Champion 1987",
      "Abbott Cup Champion 1987",
      "Doyle Cup Champion 1987",
      "Mowat Cup Champion 1987",
      "BC Hockey Hall of Fame Inductee 2025"
    ],
    "links": {
      "hockeydb": "https://www.hockeydb.com/ihdb/stats/pdisplay.php?pid=39171"
    },
    "careerStats": [
      { "season": "1983-84", "team": "Hobbema Hawks", "league": "AJHL", "type": "regular", "stats": { "gp": 45, "g": 5, "a": 15, "pts": 20, "pim": 135 } },
      { "season": "1984-85", "team": "Medicine Hat Tigers", "league": "WHL", "type": "regular", "stats": { "gp": 68, "g": 5, "a": 13, "pts": 18, "pim": 178 } },
      { "season": "1984-85", "team": "Medicine Hat Tigers", "league": "WHL", "type": "playoff", "stats": { "gp": 9, "g": 0, "a": 0, "pts": 0, "pim": 23 } },
      { "season": "1985-86", "team": "Medicine Hat Tigers", "league": "WHL", "type": "regular", "stats": { "gp": 69, "g": 2, "a": 15, "pts": 17, "pim": 123 } },
      { "season": "1985-86", "team": "Medicine Hat Tigers", "league": "WHL", "type": "playoff", "stats": { "gp": 24, "g": 1, "a": 8, "pts": 9, "pim": 65 } },
      { "season": "1986-87", "team": "Richmond Sockeyes", "league": "BCJHL", "type": "regular", "stats": { "gp": 11, "g": 2, "a": 5, "pts": 7, "pim": 24 } }
    ]
  },
  {
    "id": "russ-goglin",
    "name": "Russ Goglin",
    "position": "F",
    "number": 4,
    "hometown": "",
    "role": "player",
    "playoffStats": { "gp": 4, "g": 1, "a": 2, "pts": 3, "pim": 44 },
    "bio": "Russ Goglin's junior hockey career ran from 1983 to 1987, split between the BCJHL (Merritt Centennials/Warriors, Richmond Sockeyes) and brief WHL stops with Kamloops, Seattle, and Victoria. He joined the Richmond Sockeyes during the 1985-86 season and returned for part of their 1986-87 Centennial Cup-winning campaign.",
    "awards": [
      "Centennial Cup Champion 1987",
      "Abbott Cup Champion 1987",
      "Doyle Cup Champion 1987",
      "Mowat Cup Champion 1987",
      "BC Hockey Hall of Fame Inductee 2025"
    ],
    "links": {
      "hockeydb": "https://www.hockeydb.com/ihdb/stats/pdisplay.php?pid=39261"
    },
    "careerStats": [
      { "season": "1983-84", "team": "Merritt Centennials", "league": "BCJHL", "type": "regular", "stats": { "gp": 48, "g": 2, "a": 8, "pts": 10, "pim": 183 } },
      { "season": "1983-84", "team": "Kamloops Junior Oilers", "league": "WHL", "type": "regular", "stats": { "gp": 3, "g": 0, "a": 0, "pts": 0, "pim": 0 } },
      { "season": "1984-85", "team": "Merritt Centennials", "league": "BCJHL", "type": "regular", "stats": { "gp": 13, "g": 2, "a": 10, "pts": 12, "pim": 81 } },
      { "season": "1984-85", "team": "Seattle Breakers", "league": "WHL", "type": "regular", "stats": { "gp": 45, "g": 1, "a": 5, "pts": 6, "pim": 94 } },
      { "season": "1985-86", "team": "Merritt Warriors", "league": "BCJHL", "type": "regular", "stats": { "gp": 27, "g": 3, "a": 17, "pts": 20, "pim": 111 } },
      { "season": "1985-86", "team": "Victoria Cougars", "league": "WHL", "type": "regular", "stats": { "gp": 6, "g": 1, "a": 0, "pts": 1, "pim": 10 } },
      { "season": "1985-86", "team": "Richmond Sockeyes", "league": "BCJHL", "type": "regular", "stats": { "gp": 13, "g": 1, "a": 3, "pts": 4, "pim": 89 } },
      { "season": "1986-87", "team": "Merritt Warriors", "league": "BCJHL", "type": "regular", "stats": { "gp": 1, "g": 0, "a": 0, "pts": 0, "pim": 19 } },
      { "season": "1986-87", "team": "Richmond Sockeyes", "league": "BCJHL", "type": "regular", "stats": { "gp": 4, "g": 1, "a": 2, "pts": 3, "pim": 44 } }
    ]
  },
  {
    "id": "mike-mccormick",
    "name": "Mike McCormick",
    "position": "D",
    "number": 6,
    "hometown": "",
    "role": "player",
    "playoffStats": { "gp": 51, "g": 26, "a": 24, "pts": 50, "pim": 129 },
    "bio": "Mike McCormick was one of the Richmond Sockeyes' leading offensive contributors in 1986-87, producing 50 points and 129 PIM in 51 games en route to the Centennial Cup. He then moved to NCAA Division I hockey at the University of North Dakota (WCHA) from 1987 to 1990. McCormick turned professional with the ECHL's Greensboro Monarchs in 1989, playing more than a decade in the ECHL, CHL, and WPHL with stops including the Johnstown Chiefs, Fort Worth Fire, Wichita Thunder, Amarillo Rattlers, and Fort Worth Brahmas through the late 1990s.",
    "awards": [
      "Centennial Cup Champion 1987",
      "Abbott Cup Champion 1987",
      "Doyle Cup Champion 1987",
      "Mowat Cup Champion 1987",
      "BC Hockey Hall of Fame Inductee 2025"
    ],
    "links": {
      "hockeydb": "https://www.hockeydb.com/ihdb/stats/pdisplay.php?pid=3525"
    },
    "careerStats": [
      { "season": "1985-86", "team": "Penticton Knights", "league": "BCJHL", "type": "regular", "stats": { "gp": 4, "g": 2, "a": 0, "pts": 2, "pim": 2 } },
      { "season": "1986-87", "team": "Richmond Sockeyes", "league": "BCJHL", "type": "regular", "stats": { "gp": 51, "g": 26, "a": 24, "pts": 50, "pim": 129 } },
      { "season": "1987-88", "team": "U. of North Dakota", "league": "WCHA", "type": "regular", "stats": { "gp": 41, "g": 4, "a": 0, "pts": 4, "pim": 28 } },
      { "season": "1988-89", "team": "U. of North Dakota", "league": "WCHA", "type": "regular", "stats": { "gp": 29, "g": 1, "a": 4, "pts": 5, "pim": 22 } },
      { "season": "1989-90", "team": "U. of North Dakota", "league": "WCHA", "type": "regular", "stats": { "gp": 2, "g": 0, "a": 1, "pts": 1, "pim": 4 } },
      { "season": "1989-90", "team": "Greensboro Monarchs", "league": "ECHL", "type": "regular", "stats": { "gp": 29, "g": 16, "a": 3, "pts": 19, "pim": 13 } },
      { "season": "1989-90", "team": "Greensboro Monarchs", "league": "ECHL", "type": "playoff", "stats": { "gp": 11, "g": 7, "a": 4, "pts": 11, "pim": 19 } },
      { "season": "1990-91", "team": "Greensboro Monarchs", "league": "ECHL", "type": "regular", "stats": { "gp": 50, "g": 18, "a": 19, "pts": 37, "pim": 90 } },
      { "season": "1991-92", "team": "Greensboro Monarchs", "league": "ECHL", "type": "regular", "stats": { "gp": 31, "g": 6, "a": 4, "pts": 10, "pim": 110 } },
      { "season": "1991-92", "team": "Johnstown Chiefs", "league": "ECHL", "type": "regular", "stats": { "gp": 19, "g": 4, "a": 9, "pts": 13, "pim": 22 } },
      { "season": "1991-92", "team": "Johnstown Chiefs", "league": "ECHL", "type": "playoff", "stats": { "gp": 5, "g": 1, "a": 0, "pts": 1, "pim": 2 } },